{
  "$schema": "http://json-schema.org/draft-07/schema#",
  "$id": "https://github.com/BenjaminSRussell/Scrapy/blob/main/docs/contracts/pages.schema.json",
  "title": "pages",
  "description": "Consumer contract for Delta table stage2_page_analysis, written by Stage 2 page analysis. Not a medallion gold table and not a new directory name. Consumers must ignore unknown properties.",
  "type": "object",
  "x-contract-version": "1.0.0",
  "x-delta-table": "stage2_page_analysis",
  "x-partition-columns": ["domain"],
  "x-writers": [
    {
      "path": "Scraping_project/src/stage2/stage2_worker.py",
      "qualname": "Stage2Worker._analyze_html"
    },
    {
      "path": "Scraping_project/src/stage2/stage2_worker.py",
      "qualname": "Stage2Worker._minimal_record"
    },
    {
      "path": "Scraping_project/src/stage2/stage2_worker.py",
      "qualname": "Stage2Worker._error_record"
    },
    {
      "path": "Scraping_project/src/stage2/stage2_worker.py",
      "qualname": "Stage2Worker._route_pdf_to_stage4"
    }
  ],
  "additionalProperties": true,
  "required": [
    "url",
    "url_hash",
    "title",
    "word_count",
    "content_length",
    "html_length",
    "text_to_html_ratio",
    "is_low_quality",
    "is_massive_doc",
    "quality_score",
    "text_content",
    "keywords",
    "has_error",
    "processed_at"
  ],
  "properties": {
    "url": {
      "type": "string",
      "minLength": 1,
      "x-arrow": "string",
      "description": "Page URL that was analyzed."
    },
    "url_hash": {
      "type": "string",
      "minLength": 1,
      "x-arrow": "string",
      "description": "Hash of the canonical URL. Upsert key for this table."
    },
    "title": {
      "type": "string",
      "x-arrow": "string",
      "description": "Document title, or a placeholder such as Untitled, Error, or PDF Document."
    },
    "word_count": {
      "type": "integer",
      "minimum": 0,
      "x-arrow": "int64"
    },
    "content_length": {
      "type": "integer",
      "minimum": 0,
      "x-arrow": "int64",
      "description": "Extracted text length in characters."
    },
    "html_length": {
      "type": "integer",
      "minimum": 0,
      "x-arrow": "int64"
    },
    "text_to_html_ratio": {
      "type": "number",
      "x-arrow": "float64"
    },
    "is_low_quality": {
      "type": "boolean",
      "x-arrow": "bool"
    },
    "is_massive_doc": {
      "type": "boolean",
      "x-arrow": "bool",
      "description": "True when the page was routed toward Stage 4 as a large document."
    },
    "quality_score": {
      "type": "number",
      "x-arrow": "float64"
    },
    "text_content": {
      "type": "string",
      "x-arrow": "string",
      "description": "Extracted text, truncated by the Stage 2 writer. Empty when the page is low quality or an error."
    },
    "keywords": {
      "type": "array",
      "items": {"type": "string"},
      "x-arrow": "list<string>"
    },
    "has_error": {
      "type": "boolean",
      "x-arrow": "bool",
      "description": "True on the error-record path. Those rows are quarantined to stage2_errors and are not the silver analysis set."
    },
    "error_message": {
      "type": "string",
      "x-arrow": "string",
      "description": "Present on the error-record path only."
    },
    "error_code": {
      "type": "integer",
      "x-arrow": "int32",
      "description": "HTTP or sentinel code on the error-record path only."
    },
    "processed_at": {
      "type": "string",
      "x-arrow": "timestamp[ms]",
      "description": "ISO-8601 timestamp from the writer (datetime.isoformat). src/core/schemas.py still declares timestamp(ms); LakehouseManager does not apply that declaration on write and infers the column from the batch."
    },
    "domain": {
      "type": "string",
      "x-derived": true,
      "description": "Partition column. LakehouseManager sets the public-suffix registrable domain of url. Not a writer field. Rows with no usable host go to domain_quarantine instead of this table."
    }
  }
}
